{
  "domain": "tourism-dispute-resolution",
  "version": 2,
  "sample_id": "record-013",
  "actors": [
    "入境游客",
    "境外组团社",
    "国内地接社",
    "景区",
    "承运人",
    "支付机构",
    "调解人员",
    "区域文旅合作方（协商服务运营方）"
  ],
  "facts": [
    "入境团队游因航班变化取消一段行程时，境外组团社、国内地接、景区、承运人和支付机构各自计算责任",
    "游客收到多笔不同币种退款，却难以确认哪些服务尚未解决",
    "协商服务以原合同和实际履约事件为基础，归并多语种陈述、票据、服务确认、汇率时点和各方责任意见",
    "系统自动发现重复索赔，但不替代人工裁决"
  ],
  "constraints": [
    "同行人拆分、部分履约、证据补交、时限暂停、调解失败和支付退回必须保持清晰顺序",
    "游客始终能看见未决项目与下一责任方",
    "企业只能访问与自身服务有关的材料",
    "调解人员可生成逐项可解释的和解方案",
    "核对所有退款、代金安排和书面结论是否真正执行"
  ],
  "workflow": [
    "争议登记",
    "证据归并",
    "责任意见汇总",
    "重复索赔核查",
    "和解方案生成",
    "人工裁决确认",
    "退款与代金执行",
    "执行核对与结案"
  ]
}
